{
  "$schema": "http://json-schema.org/draft-04/schema#",
  "items": {
    "additionalProperties": false,
    "properties": {
      "f0": {
        "type": "integer"
      },
      "f1": {
        "type": "integer"
      },
      "f2": {
        "type": "integer"
      },
      "f3": {
        "type": "integer"
      },
      "f4": {
        "type": "integer"
      },
      "f5": {
        "type": "integer"
      },
      "f6": {
        "type": "integer"
      },
      "f7": {
        "type": "integer"
      }
    },
    "required": [
      "f0",
      "f1",
      "f2",
      "f3",
      "f4",
      "f5",
      "f6",
      "f7"
    ],
    "type": "object"
  },
  "maxItems": 1024,
  "minItems": 1024,
  "type": "array"
}
